{
  "draftStatusWarning": "Unstable pre-0.1 review schema for draft-infantado-agent-memory-architecture-00; candidate interoperability model, not a frozen protocol contract.",
  "spec_version": "pamspec-00",
  "object_id": "mem:claim:create",
  "version_id": "ver:claim:create:1",
  "scope_id": "workspace:example",
  "object_type": "claim",
  "schema_id": "https://example.invalid/pama/claim",
  "canonical_content": {
    "statement": "A Memory Object has stable identity."
  },
  "lifecycle_state": "active",
  "validation_state": "unverified",
  "created_at": "2026-07-11T00:00:00Z",
  "updated_at": "2026-07-11T00:00:00Z",
  "actor": {
    "actor_id": "actor:editor:001",
    "actor_kind": "human"
  },
  "provenance": {
    "generated_at": "2026-07-11T00:00:00Z",
    "actor": {
      "actor_id": "actor:editor:001",
      "actor_kind": "human"
    },
    "sources": [
      {
        "kind": "draft-review"
      }
    ],
    "method": "human-authored"
  },
  "relationships": [],
  "integrity": {
    "digest": "sha256:example"
  }
}
